{"$schema":"https://json-schema.org/draft/2020-12/schema","title":"Component name entry","type":"object","required":["category","local_id","source_offset","runtime_address","display_names","name_pointers","confidence","evidence"],"properties":{"category":{"type":"string"},"local_id":{"type":"integer","minimum":0},"global_id":{"type":["integer","null"]},"source_offset":{"type":"string","pattern":"^0x[0-9A-F]{8}$"},"runtime_address":{"type":"string","pattern":"^0x08[0-9A-F]{6}$"},"display_names":{"type":"object"},"name_pointers":{"type":"array","minItems":5,"maxItems":5},"confidence":{"enum":["confirmed","strongly_supported","candidate","unknown"]},"evidence":{"type":"array","items":{"type":"string"}},"raw_bytes":{"type":"string"}}}
