[
  {
    "category": "spin-gears",
    "local_id": 0,
    "global_id": null,
    "source_offset": "0x0007AF0C",
    "runtime_address": "0x0807AF0C",
    "display_names": {
      "english": "Normal",
      "french": "Normal",
      "german": "Normal",
      "italian": "Normal",
      "spanish": "Normal"
    },
    "name_pointers": [
      "0x0833D334",
      "0x0833D334",
      "0x0833D334",
      "0x0833D334",
      "0x0833D334"
    ],
    "confidence": "confirmed",
    "evidence": [
      "five language-major pointer arrays; IDs correlate with complete-template field"
    ]
  },
  {
    "category": "spin-gears",
    "local_id": 1,
    "global_id": null,
    "source_offset": "0x0007AF10",
    "runtime_address": "0x0807AF10",
    "display_names": {
      "english": "Neo",
      "french": "Neo",
      "german": "Neo",
      "italian": "Neo",
      "spanish": "Neo"
    },
    "name_pointers": [
      "0x0833D330",
      "0x0833D330",
      "0x0833D330",
      "0x0833D330",
      "0x0833D330"
    ],
    "confidence": "confirmed",
    "evidence": [
      "five language-major pointer arrays; IDs correlate with complete-template field"
    ]
  },
  {
    "category": "spin-gears",
    "local_id": 2,
    "global_id": null,
    "source_offset": "0x0007AF14",
    "runtime_address": "0x0807AF14",
    "display_names": {
      "english": "Engine Gear",
      "french": "Engine Gear",
      "german": "Engine Gear",
      "italian": "Engine Gear",
      "spanish": "Engine Gear"
    },
    "name_pointers": [
      "0x0833D324",
      "0x0833D324",
      "0x0833D324",
      "0x0833D324",
      "0x0833D324"
    ],
    "confidence": "confirmed",
    "evidence": [
      "five language-major pointer arrays; IDs correlate with complete-template field"
    ]
  },
  {
    "category": "spin-gears",
    "local_id": 3,
    "global_id": null,
    "source_offset": "0x0007AF18",
    "runtime_address": "0x0807AF18",
    "display_names": {
      "english": "South",
      "french": "South",
      "german": "South",
      "italian": "South",
      "spanish": "South"
    },
    "name_pointers": [
      "0x0833D31C",
      "0x0833D31C",
      "0x0833D31C",
      "0x0833D31C",
      "0x0833D31C"
    ],
    "confidence": "confirmed",
    "evidence": [
      "five language-major pointer arrays; IDs correlate with complete-template field"
    ]
  },
  {
    "category": "spin-gears",
    "local_id": 4,
    "global_id": null,
    "source_offset": "0x0007AF1C",
    "runtime_address": "0x0807AF1C",
    "display_names": {
      "english": "Metal Flat",
      "french": "Metal Flat",
      "german": "Metal Flat",
      "italian": "Metal Flat",
      "spanish": "Metal Flat"
    },
    "name_pointers": [
      "0x0833D310",
      "0x0833D310",
      "0x0833D310",
      "0x0833D310",
      "0x0833D310"
    ],
    "confidence": "confirmed",
    "evidence": [
      "five language-major pointer arrays; IDs correlate with complete-template field"
    ]
  },
  {
    "category": "spin-gears",
    "local_id": 5,
    "global_id": null,
    "source_offset": "0x0007AF20",
    "runtime_address": "0x0807AF20",
    "display_names": {
      "english": "Grip Flat Core",
      "french": "Grip Flat Core",
      "german": "Grip Flat Core",
      "italian": "Grip Flat Core",
      "spanish": "Grip Flat Core"
    },
    "name_pointers": [
      "0x0833D300",
      "0x0833D300",
      "0x0833D300",
      "0x0833D300",
      "0x0833D300"
    ],
    "confidence": "confirmed",
    "evidence": [
      "five language-major pointer arrays; IDs correlate with complete-template field"
    ]
  },
  {
    "category": "spin-gears",
    "local_id": 6,
    "global_id": null,
    "source_offset": "0x0007AF24",
    "runtime_address": "0x0807AF24",
    "display_names": {
      "english": "Metal Semi Flat",
      "french": "Metal Semi Flat",
      "german": "Metal Semi Flat",
      "italian": "Metal Semi Flat",
      "spanish": "Metal Semi Flat"
    },
    "name_pointers": [
      "0x0833D2F0",
      "0x0833D2F0",
      "0x0833D2F0",
      "0x0833D2F0",
      "0x0833D2F0"
    ],
    "confidence": "confirmed",
    "evidence": [
      "five language-major pointer arrays; IDs correlate with complete-template field"
    ]
  },
  {
    "category": "spin-gears",
    "local_id": 7,
    "global_id": null,
    "source_offset": "0x0007AF28",
    "runtime_address": "0x0807AF28",
    "display_names": {
      "english": "Heavy Metal",
      "french": "Heavy Metal",
      "german": "Heavy Metal",
      "italian": "Heavy Metal",
      "spanish": "Heavy Metal"
    },
    "name_pointers": [
      "0x0833D2E4",
      "0x0833D2E4",
      "0x0833D2E4",
      "0x0833D2E4",
      "0x0833D2E4"
    ],
    "confidence": "confirmed",
    "evidence": [
      "five language-major pointer arrays; IDs correlate with complete-template field"
    ]
  },
  {
    "category": "spin-gears",
    "local_id": 8,
    "global_id": null,
    "source_offset": "0x0007AF2C",
    "runtime_address": "0x0807AF2C",
    "display_names": {
      "english": "Semi Flat",
      "french": "Semi Flat",
      "german": "Semi Flat",
      "italian": "Semi Flat",
      "spanish": "Semi Flat"
    },
    "name_pointers": [
      "0x0833D2D8",
      "0x0833D2D8",
      "0x0833D2D8",
      "0x0833D2D8",
      "0x0833D2D8"
    ],
    "confidence": "confirmed",
    "evidence": [
      "five language-major pointer arrays; IDs correlate with complete-template field"
    ]
  },
  {
    "category": "spin-gears",
    "local_id": 9,
    "global_id": null,
    "source_offset": "0x0007AF30",
    "runtime_address": "0x0807AF30",
    "display_names": {
      "english": "Sharp Core",
      "french": "Sharp Core",
      "german": "Sharp Core",
      "italian": "Sharp Core",
      "spanish": "Sharp Core"
    },
    "name_pointers": [
      "0x0833D2CC",
      "0x0833D2CC",
      "0x0833D2CC",
      "0x0833D2CC",
      "0x0833D2CC"
    ],
    "confidence": "confirmed",
    "evidence": [
      "five language-major pointer arrays; IDs correlate with complete-template field"
    ]
  },
  {
    "category": "spin-gears",
    "local_id": 10,
    "global_id": null,
    "source_offset": "0x0007AF34",
    "runtime_address": "0x0807AF34",
    "display_names": {
      "english": "Gyro EG",
      "french": "Gyro EG",
      "german": "Gyro EG",
      "italian": "Gyro EG",
      "spanish": "Gyro EG"
    },
    "name_pointers": [
      "0x0833D2C4",
      "0x0833D2C4",
      "0x0833D2C4",
      "0x0833D2C4",
      "0x0833D2C4"
    ],
    "confidence": "confirmed",
    "evidence": [
      "five language-major pointer arrays; IDs correlate with complete-template field"
    ]
  },
  {
    "category": "spin-gears",
    "local_id": 11,
    "global_id": null,
    "source_offset": "0x0007AF38",
    "runtime_address": "0x0807AF38",
    "display_names": {
      "english": "Circle Defenser",
      "french": "Circle Defenser",
      "german": "Circle Defenser",
      "italian": "Circle Defenser",
      "spanish": "Circle Defenser"
    },
    "name_pointers": [
      "0x0833D2B4",
      "0x0833D2B4",
      "0x0833D2B4",
      "0x0833D2B4",
      "0x0833D2B4"
    ],
    "confidence": "confirmed",
    "evidence": [
      "five language-major pointer arrays; IDs correlate with complete-template field"
    ]
  },
  {
    "category": "spin-gears",
    "local_id": 12,
    "global_id": null,
    "source_offset": "0x0007AF3C",
    "runtime_address": "0x0807AF3C",
    "display_names": {
      "english": "EG Free Shaft",
      "french": "CG Free Shaft",
      "german": "CG Free Shaft",
      "italian": "CG Free Shaft",
      "spanish": "CG Free Shaft"
    },
    "name_pointers": [
      "0x0833D2A4",
      "0x0833D33C",
      "0x0833D33C",
      "0x0833D33C",
      "0x0833D33C"
    ],
    "confidence": "confirmed",
    "evidence": [
      "five language-major pointer arrays; IDs correlate with complete-template field"
    ]
  },
  {
    "category": "spin-gears",
    "local_id": 13,
    "global_id": null,
    "source_offset": "0x0007AF40",
    "runtime_address": "0x0807AF40",
    "display_names": {
      "english": "EG Circle Survivor",
      "french": "EG Circle Survivor",
      "german": "EG Circle Survivor",
      "italian": "EG Circle Survivor",
      "spanish": "EG Circle Survivor"
    },
    "name_pointers": [
      "0x0833D290",
      "0x0833D290",
      "0x0833D290",
      "0x0833D290",
      "0x0833D290"
    ],
    "confidence": "confirmed",
    "evidence": [
      "five language-major pointer arrays; IDs correlate with complete-template field"
    ]
  },
  {
    "category": "spin-gears",
    "local_id": 14,
    "global_id": null,
    "source_offset": "0x0007AF44",
    "runtime_address": "0x0807AF44",
    "display_names": {
      "english": "EG Reverse",
      "french": "EG Reverse",
      "german": "EG Reverse",
      "italian": "EG Reverse",
      "spanish": "EG Reverse"
    },
    "name_pointers": [
      "0x0833D284",
      "0x0833D284",
      "0x0833D284",
      "0x0833D284",
      "0x0833D284"
    ],
    "confidence": "confirmed",
    "evidence": [
      "five language-major pointer arrays; IDs correlate with complete-template field"
    ]
  },
  {
    "category": "spin-gears",
    "local_id": 15,
    "global_id": null,
    "source_offset": "0x0007AF48",
    "runtime_address": "0x0807AF48",
    "display_names": {
      "english": "Flat Core",
      "french": "Flat Core",
      "german": "Flat Core",
      "italian": "Flat Core",
      "spanish": "Flat Core"
    },
    "name_pointers": [
      "0x0833D278",
      "0x0833D278",
      "0x0833D278",
      "0x0833D278",
      "0x0833D278"
    ],
    "confidence": "confirmed",
    "evidence": [
      "five language-major pointer arrays; IDs correlate with complete-template field"
    ]
  },
  {
    "category": "spin-gears",
    "local_id": 16,
    "global_id": null,
    "source_offset": "0x0007AF4C",
    "runtime_address": "0x0807AF4C",
    "display_names": {
      "english": "Semi Flat Core",
      "french": "Semi Flat Core",